"jobtitle","company","location","salary","companysize","companyrating","summary"
"User Experience Designer","Amper Music, Inc.","New York, NY","$60,000 - $80,000 a year",nan,nan,"We are a team of musicians, technologists, and passionate creators who believe that humans and artificial intelligence are extraordinary, creative collaborators..."
"Design Verification Engineer","Intel","Santa Clara, CA 95052","NA",nan,52.2,"NA"
"Siri Software Engineer, Productivity","Apple","Santa Clara Valley, CA","NA",nan,52.2,"Create groundbreaking technology for artificial intelligence. Play a part in the next revolution in human-computer interaction...."
"Machine Learning Scientist/Engineer","AM Pierce & Associates","Patuxent River, MD","NA",3,60.0,"3-5 years of internships or work experience in artificial intelligence, data science, machine learning, big-data analysis or machine vision;..."
"Director of Data Science","Booz Allen Hamilton","McLean, VA","NA",nan,44.4,"4+ years of experience with Big Data Architecture, Big Table structures, Data platform, Hadoop clusters, Machine and Deep Learning, Computer Visioning,..."
"Backend Software Engineer","AiCure","New York, NY","NA",nan,nan,"You'll be up to speed in the the most recent advances in Artificial Intelligence (Machine Learning, Computer Vision, Big Data) while solving challenging..."
"Senior Data Scientist","Intuit","San Diego, CA 92129","NA",750,52.2,"Artificial intelligence and applying innovative machine learning. Intuit is hiring a Data Scientist to...."
"Research Associate, Technology & National Security Program","Center for a New American Security","Washington, DC","NA",nan,nan,"Artificial intelligence and automation raise profound questions about the role of humans in conflict and war...."
"Research Scientist for Quantum Computing","Universities Space Research Association","Mountain View, CA","NA",8,53.4,"NA"
"Director of Machine Learning","UPMC","Pittsburgh, PA 15206 (Larimer area)","NA",507,42.6,"Lead and mentor a team whose responsibility is to develop prototype solutions at the intersection of healthcare and artificial intelligence...."
"Senior Software Engineer, Dynamic Object Tracking","Toyota Research Institute","Los Altos, CA","NA",nan,nan,"And (4) accelerate scientific discovery by applying techniques from artificial intelligence and machine learning...."
"Software Engineer, Computational Photography","Google","Mountain View, CA","NA",nan,52.8,"We're looking for engineers who bring fresh ideas from all areas, including information retrieval, distributed computing, large-scale system design, networking..."
"Compute Performance Developer Technology Engineer","NVIDIA","Santa Clara, CA","NA",137,52.2,"Deep Learning, Artificial Intelligence, Autonomous Vehicles, Supercomputing and more. We are now looking for a Compute Performance Developer Technology Engineer..."
"WW (CoC) - Talent & Engagement - Talent Analytics","IBM","United States","NA",nan,51.0,"At least 5 years experience defining and implementing business-focused talent analytics capabilities for HR organizations, such as predictive models and..."
"Siri Data Engineer","Apple","Santa Clara Valley, CA","NA",nan,52.2,"Create groundbreaking technology for large scale systems, spoken language, big data, and artificial intelligence...."
"Senior Product Marketing Manager","Microsoft","Redmond, WA 98052","NA",nan,52.2,"Drive the fiscal-year editorial calendar for Data, Advanced Analytics, and Artificial Intelligence, ensuring a connective marketing tissue across the business...."
"BI Engineer - Alexa Engagement","Amazon Corporate LLC","Seattle, WA","NA",nan,43.2,"We use artificial intelligence, data mining and usability studies to develop new features, and we test them through hundreds of R & D experiments a year...."
"Office Coordinator","Demandbase","New York, NY","NA",3,51.0,"Drive the next generation of intelligent CRM technologies and invent how Artificial Intelligence, product design, and applications converge...."
"Serious Game Engineer","Cubic Corporation","Orlando, FL 32809","NA",132,42.6,"Multiplayer/network applications, 3D rendering, artificial intelligence, or game development experience is highly desired. Serious Game Engineer...."
"Business Engineer - Derivatives Clearing","Credit Suisse","Raleigh, NC","NA",930,51.0,"Robotics, Utilization, Artificial Intelligence). Credit Suisse is a leading global wealth manager with strong investment banking and asset management..."
"Student Intern - PHP Web Developer","TechWave International","Houston, TX","NA",nan,nan,"This could be your best chance to work on latest technology (Cloud, Big Data Analytics, Artificial Intelligence, Machine Learning, NLP and more) in a..."
"Machine Learning Researcher, Platform Architecture","Apple","Seattle, WA","NA",nan,52.2,"Researching, developing and implementing the most innovative machine learning, artificial intelligence, computer vision and NLP techniques...."
"Technical Community Manager","Mycroft AI Inc","Kansas City, MO","$40,000 - $70,000 a year",nan,nan,"NA"
"2017 - 2018 Campus Internship - Information Systems Analyst","The Dow Chemical Company","Midland, MI","NA",846,51.6,"They will support critical business and technical needs for Dow business, research, and manufacturing functions around the world in a variety of technology..."
"Linux Container Software Development Engineer","NVIDIA","Santa Clara, CA","NA",137,52.2,"NA"
"Sr. Analytic Scientist","FICO","San Diego, CA","NA",91,43.2,"Be a part of a team who helps to wipe out financial fraud activities by staying at the forefront of Artificial Intelligence (AI) and Machine Learning (ML)...."
"SQA Engineer","Align Technology Inc","San Jose, CA","NA",36,51.0,"Behind the scenes, we leverage new 3D computerized treatment simulation and artificial intelligence as well as 3D printing, complex bio-mechanics and advanced..."
"Data Engineer (Associate to Principal)","XPO Logistics","Portland, OR 97209 (Pearl District area)","NA",nan,40.8,"This team is responsible for end to end data management which includes, data modeling, data integration, data warehousing and providing business benefits..."
"Digital Design Engineer","Intel","Santa Clara, CA 95052","NA",nan,52.2,"NA"
"Software Engineer, Language Technologies","Apple","Santa Clara Valley, CA","NA",nan,52.2,"Create groundbreaking technology for large-scale systems, spoken language, big data, and artificial intelligence...."
"Director of Sales - Hospitals / Healthcare","OfferCraft","Las Vegas, NV","$100,000 - $200,000 a year",nan,nan,"The technology is incredibly innovative, and combines gamification with artificial intelligence to motivate true behavior change...."
"SAP Big Data Strategist","Cognizant","Cherry Hill, NJ","NA",nan,51.0,"NA"
"Co-Op / Intern","ZF TRW","Livonia, MI","NA",745,44.4,"To offer digital products and services, we need to build knowledge in Super Computing, Artificial Intelligence and New Business Models...."
"KDD Conference: Data Scientists and Machine Learning Researc...","American Express","New York, NY","NA",nan,52.2,"Research in machine learning, data science, and artificial intelligence; American Express invites you, KDD 2017 attendants and/or affiliates, to share your..."
"Patent Agent (In-house)","Brain Corporation","San Diego, CA","NA",nan,nan,"Brain Corporation, a startup that applies artificial intelligence and machine learning to robotics, is seeking an in-house IP Agent/Manager to assist in the..."
"Research Scientist - MEMS | Mobile Sensors","EyeVerify, Inc.","Kansas City, OR","NA",nan,nan,"You will develop new biometric products through your expertise in human motion, motion sensor technology, sensor fusion techniques and artificial intelligence...."
"Big Data Engineer","CVS Health","Richardson, TX","NA",nan,42.6,"Understanding of Machine Learning and Artificial Intelligence advanced analytics. Analyzing Big Data Analytic technologies and applications in both business..."
"Data Subject Matter Expert","Scienaptic Systems Inc","New York, NY","NA",nan,nan,"We are creating ecosystems where artificial intelligence (AI) and human intelligence can work together to create greater consciousness for specific business use..."
"Health Advocate","Wellframe","Boston, MA","NA",nan,nan,"About Wellframe Wellframe is a Boston-based digital health company focused on building the next generation of infrastructure for care delivery by combining..."
"ML Engineer","Cognitive Scale","Austin, TX","NA",nan,nan,"Strong interest in, and knowledge of Artificial Intelligence and its subfields. We live in a moment of remarkable change and opportunity that is cognitive..."
"Machine Learning Scientist","Adobe","San Jose, CA","NA",328,52.2,"Machine learning, natural language processing, computer vision, classifiers, large-scale data mining or artificial intelligence...."
"Multimodal Machine Learning Scientist","Amazon Corporate LLC","Cambridge, MA","NA",nan,43.2,"NA"
"Artificial Intelligence Software Engineer","Lockheed Martin","Palmdale, CA 93599","NA",nan,51.6,"The engineer will join a fast paced, rapid prototyping team focused on applied artificial intelligence. The Skunk Works (Lockheed Martin Advanced Development..."
"Deep Learning Data Processing Software Engineer","NVIDIA","Santa Clara, CA","NA",137,52.2,"Deep Learning, Artificial Intelligence, and Autonomous Vehicles. We are now looking for a Deep Learning Data Processing Software Engineer:...."
"Embedded/Mobile Engineer - Maps Research","Uber","Palo Alto, CA 94304","NA",214,44.4,"Do you want to push the limits of what is possible in terms of applying artificial intelligence techniques on mobile phones?..."
"Chief Data Scientist","SmartAssist.io","Bellevue, WA","NA",nan,nan,"SmartAssist is looking for a Chief Data Scientist leading a team of Data Scientists to build an Artificial Intelligence and Machine Learning application in the..."
"Machine Learning Engineer","imo.im","Palo Alto, CA 94306 (Barron Park area)","NA",nan,nan,"Participate in cutting edge research in artificial intelligence and machine learning applications. 1 year of work or educational experience in Machine Learning..."
"AI / Machine Learning Researcher, Financial Services","Sentient","San Francisco, CA","NA",4,30.0,"NA"
"CTO","iSpace Inc.","El Segundo, CA 90245","NA",nan,nan,"Skilled with strategizing enterprise data strategy, i.e. analytics, reporting, data warehousing, machine learning, artificial intelligence...."
"Artificial Intelligence Security Researcher","Intel","Hillsboro, OR 97124","NA",nan,52.2,"This role will focus on the research/design/development of hardware/software architectures and prototypes of leading edge security solutions leveraging the..."
"Machine Learning","Vertisystem","Santa Clara, CA","NA",nan,nan,"Machine learning, recommendation systems, categorization, large-scale data mining or artificial intelligence, NLP...."
"Machine Learning Researcher","Apple","Santa Clara Valley, CA","NA",nan,52.2,"The Artificial Intelligence Research team in an Apple Special Projects Group is looking for Research Scientists and Engineers...."
"Artificial Intelligence Engineer","Accenture","Chicago, IL","NA",nan,51.0,"Artificial Intelligence resources at the Consultant level will be responsible for developing cognitive applications to solve business problems using leading AI..."
"Systems Engineer (UTM)","Thales","United States","NA",323,51.0,"Thales has created a new cloud-hosted product aimed at improving aeronautical operations by leveraging modern IT capabilities and emerging Big Data techniques..."
"Postdoctoral Research Fellowship","University of Michigan","Ann Arbor, MI","NA",713,53.4,"Use of mobile health technology to improve chronic illnesses Treatment of diabetes and associated complications Management of depression and dementia among the..."
"Machine Learning Engineer","Radiance Technologies Inc.","Dayton, OH 45431","NA",nan,nan,"Radiance is seeking a Machine Learning Engineer who will advance the artificial intelligence capabilities of the National Air and Space Intelligence Center at..."
"Intern, Simulation Environment Development","Toyota InfoTechnology Center","Mountain View, CA 94043","NA",nan,51.0,"NA"
"ETL Data Engineer","Partners HealthCare(PHS)","Boston, MA","NA",243,51.0,"The Center for Clinical Data Science (CCDS) aims to transform healthcare through cutting-edge data science, machine learning, and artificial intelligence (AI)...."
"Senior Manager, Product Management","E*TRADE FINANCIAL","Chicago, IL","NA",242,43.2,"The primary responsibilities for the Senior Manager will be leading an innovation lab focusing on blockchain, artificial intelligence, and emerging technologies..."
"Event Management - SecureWorks","Dell","Atlanta, GA","NA",nan,51.0,"NA"
"Staff ML Engineer","Visa","Austin, TX","NA",439,51.0,"2 years of work experience in Machine Learning or Artificial Intelligence. As a machine learning engineer, you will be responsible for designing and..."
"Senior Data Scientist","Hyperloop One","Los Angeles, CA","NA",5,51.0,"The Data Scientist will be part of the Machine Intelligence and Analytics team. Develop metrics and evaluation criteria to characterize and quantify system..."
"Principal Data Scientist","Ampsight","Virginia","NA",nan,nan,"MS or PhD in a quantitative discipline like Computer Science (with focus on Machine Learning, Artificial Intelligence), Statistics, Math, Physics, etc...."
"Siri Software Engineer - Geos","Apple","Santa Clara Valley, CA","NA",nan,52.2,"Create groundbreaking technology for large scale systems, spoken language, big data, and artificial intelligence...."
"Digital Marketing Consultant","NextGen Intelligent Marketing Solutions","Columbus, OH","$100,000 - $250,000 a year",nan,nan,"Our solutions include *Artificial Intelligence Marketing Solutions, Virtual Reality, Advanced Proprietary Software targeting solutions, mobile advertising, SEO,..."
"Analyst, Marketing Sciences","Blackwood Seven","Los Angeles, CA","NA",nan,nan,"NA"
"Head of Data and Analytics Architecture","Citi","United States","NA",nan,44.4,"NA"
"Implementation Manager","HealthMine","Dallas, TX 75219 (Oak Lawn area)","NA",nan,nan,"The Only Health Intelligence Solution:. HealthMine has developed the only Health Intelligence solution for health insurers that uses artificial intelligence to..."
"Rotational Development Program, Software Engineer","Trimble Inc.","Westminster, CO","NA",nan,nan,"Domain related experience or knowledge with computer vision, photogrammetry, 3D modeling, artificial Intelligence, signal processing, image recognition, GNSS or..."
"Artificial Intelligence (AI) Developer","Cambria Solutions, Inc","Sacramento, CA","NA",nan,nan,"Deep Learning, Machine Learning, Natural Language Processing, Computer Vision, Recommendation Systems, Pattern Recognition, Large Scale Data Mining or..."
"Staff Process Modeling Engineer","Arconic","New Kensington, PA","NA",42,31.8,"Establish a protocol for materials development (process-microstructure-properties) that when combined with data analytics, machine learning and artificial..."
"Autonomous Vehicle Perception Engineer","NVIDIA","Santa Clara, CA","NA",137,52.2,"Familiarity with deep learning / artificial intelligence is desirable. Experience with Machine Learning, Deep Learning or other Artificial Intelligence..."
"Frontend Engineer to impact patient lives through AI","AiCure","New York, NY","NA",nan,nan,"You'll be up to speed on the most recent advances in Artificial Intelligence (Machine Learning, Computer Vision, Big Data) while solving challenging problems in..."
"Software Engineer","Daimler","Sunnyvale, CA","NA",773,52.2,"Background in machine learning, artificial intelligence or advanced statistics. Machine learning and artificial intelligence are core to the intelligent..."
"Machine Learning Developer","Lirio","Knoxville, TN 37922","NA",nan,nan,"Machine learning and artificial intelligence are at the heart of our organization, and we are building a team of bright, invigorated life-long learners to make..."
"Research Associate - Cellular Pharmacology","Recursion Pharmaceuticals","Salt Lake City, UT","NA",nan,nan,"Our unique platform leverages the most advanced high-throughput scalable biology, automation, and artificial intelligence to rapidly discover treatments for..."
"Siri Software Engineer - Knowledge Graph","Apple","Santa Clara Valley, CA","NA",nan,52.2,"The Siri Search team is creating groundbreaking technology for algorithmic search, machine learning, natural language processing, and artificial intelligence...."
"Software Engineering Manager, Platforms","Google","Mountain View, CA","NA",nan,52.8,"SWE teams work all across the company, in areas such as information retrieval, artificial intelligence, natural language processing, distributed computing,..."
"Machine Learning Engineer, Platform Architecture - ML Platfo...","Apple","Seattle, WA","NA",nan,52.2,"Deep technical skills in machine learning, deep learning, computer vision, natural language processing, or artificial intelligence...."
"Research Engineer - Salesforce Research (MetaMind)","Salesforce","Palo Alto, CA","NA",246,52.8,"Participate in cutting-edge research in machine learning and artificial intelligence. MA/MS or PhD degree in Computer Science, Artificial Intelligence, Machine..."
"NA","Georgia Tech Research Institute","Atlanta, GA 30318 (Rockdale area)","NA",340,52.8,"POSITION SUMMARY: This job posting represents full time opportunities within the Electro-Optical Systems Laboratory in one or more of the following domains"
"Machine Learning Developer","Modern Technology Solutions, Inc. (MTSI)","Huntsville, AL","NA",23,52.8,"Our expertise includes ballistic missile defense, air defense, air vehicle survivability, unmanned aircraft, flight test operations, intelligence support, and..."
"Deep Learning Inference-Kernel and Performance Software Engi...","NVIDIA","Santa Clara, CA","NA",137,52.2,"Just as human imagination and intelligence are linked, computer graphics and artificial intelligence come together in our architecture...."
"Advanced Analytics Consultant","Slalom Consulting","Seattle, WA 98104 (First Hill area)","NA",26,44.4,"Experience with core quantitative analysis techniques (e.g., predictive modeling, machine learning, artificial intelligence or natural language processing)...."
"Core OS Machine Learning and Differential Privacy Engineer","Apple","Santa Clara Valley, CA","NA",nan,52.2,"In Machine Learning, Data Privacy, Artificial Intelligence, Statistics or a related discipline. You will be a part of the group that is responsible for shipping..."
"Natural Language Processing Engineer","Oben","Pasadena, CA","NA",nan,nan,"Strong interest in, and knowledge of Artificial Intelligence and its subfields. Build, Improve and extend NLP capabilities Research and evaluate new/different..."
"Customer Support Representative","Conversica","Bellingham, WA 98225","NA",4,43.8,"Located in downtown Bellingham, Conversica builds artificial intelligence powered software focused on helping companies grow...."
"Jr. Business Development Associate","Originate","Newport Beach, CA","NA",nan,nan,"Originate partners with startups and enterprises to design, build, and operate transformative software. We bring together world class designers, product"
"Watson Health Medical Imaging - Senior User Research Designe...","IBM","Cambridge, MA 02142 (East Cambridge area)","NA",nan,51.0,"Experience with natural language processing or artificial intelligence software. Detailed description of opening:...."
"Staff Computer Vision Scientist","General Electric","Boston, MA 02212 (Central area)","NA",nan,51.6,"NA"
"Modeler/Analyst","Blackwood Seven","New York, NY","NA",nan,nan,"NA"
"Research Scientist - Innovation and Enabling Biology","Recursion Pharmaceuticals","Salt Lake City, UT","NA",nan,nan,"Our unique platform leverages the most advanced high-throughput biology, automation, and artificial intelligence to rapidly discover treatments for rare..."
"Senior Data Scientist","Microsoft","Redmond, WA 98052","NA",nan,52.2,"Are you passionate about artificial intelligence and algorithm development? Do you enjoy learning new technologies and applying them to data problems?..."
"Test Engineer AI Frameworks Software","Intel","Santa Clara, CA 95052","NA",nan,52.2,"NA"
"Software Engineer","Language Computer Corporation","Richardson, TX 75080","NA",nan,nan,"Previous exposure to Natural language processing (NLP), linguistics, artificial intelligence (AI), and/or speech processing experience...."
"Data Scientist","Voda Inc.","Boston, MA 02109 (Central area)","$60,000 - $80,000 a year",nan,nan,"Completes analyses by collecting, tracking, analyzing, and documenting data and for developing mathematical, statistical, and artificial intelligence algorithms..."
"Computer Vision Research Engineer - Opportunity to Impact Pa...","AiCure","New York State","NA",nan,nan,"You'll be up to speed on the most recent advances in Artificial Intelligence (Machine Learning, Computer Vision, Big Data) while solving challenging problems in..."
"RSM - SST","HGST","Milpitas, CA","NA",67,51.6,"NA"
"C++ Software Architect - Mitek Labs","Mitek Systems","San Diego, CA","NA",nan,nan,"NA"
"Senior Analyst - Data Analytics","United Airlines Inc.","Chicago, IL 60601 (Loop area)","NA",nan,51.0,"NA"
"Data Engineer","Mitek Systems","San Diego, CA","NA",nan,nan,"NA"
"Program Manager - Digital Transformation","American Computer Services, Inc.","Des Moines, IA","$110,000 - $140,000 a year",nan,nan,"NA"
"Vice President, Technology Services Innovation","CSRA","Falls Church, VA","NA",161,41.4,"NA"
"University Recruiting Sourcer","NVIDIA","Santa Clara, CA","NA",137,52.2,"NA"
"Postdoctoral Research Scholar","North Carolina State University","Raleigh, NC","NA",533,52.2,"NA"
"Siri Speech Data Engineer","Apple","Santa Clara Valley, CA","NA",nan,52.2,"NA"
"Siri Data Server Engineer","Apple","Santa Clara Valley, CA","NA",nan,52.2,"NA"
"NA","Westfield Corporation","San Francisco, CA","NA",20,39.0,"NA"
"Senior Futurist","DEPT OF INFO TECH & TELECOMM","Brooklyn, NY","$60,435 - $140,000 a year",nan,nan,"NA"
"Director of Sales - Healthcare","OfferCraft","Washington, DC","$100,000 - $200,000 a year",nan,nan,"NA"
"Automation Scientist","Recursion Pharmaceuticals","Salt Lake City, UT","NA",nan,nan,"NA"
"software engineer - image processing","Boston Meditech Group","Burlington, MA","$60,000 - $120,000 a year",nan,nan,"NA"
"IBM Digital iX & Cognitive, Public - Cognitive Senior Consul...","IBM","Washington, DC 20005 (Logan Circle area)","NA",nan,51.0,"NA"
"Fall / Winter Intern, Digital Twin of Connected Cars","Toyota InfoTechnology Center","Mountain View, CA 94043","NA",nan,51.0,"NA"
"Associate Partner","IBM","United States","NA",nan,51.0,"NA"
"Project Administrator","The Tauri Group","Arlington, VA","NA",nan,nan,"NA"
"Intern - Global Active Safety Research & Development Synchro...","Daimler","Portland, OR","NA",773,52.2,"Prior internships / work experience in data analytics, artificial intelligence, strategy and business concept development required...."
"Data Scientist","Thomson Reuters","United States","NA",nan,51.0,"Serve as a key team member on complex, strategic data projects ensuring high quality deliverables via data processing, predictive analytics and artificial..."
"Field Application Engineer","Pilot AI","Redwood City, CA","$100,000 - $150,000 a year",nan,nan,"Excellent knowledge of Deep Learning and Artificial Intelligence. Interested in a high profile, highly empowered role;..."
"Senior Software Engineer - C/C++","NTENT","Carlsbad, CA 92008","NA",3,39.0,"Our goals include building a compelling search experience for mobile devices and applying state of the art artificial intelligence approaches to understand..."
"Machine Learning Researcher","Keysight Technologies","Atlanta, GA","NA",57,51.0,"Masters in Computer Science, Mathematics, Electrical Engineering or other relevant field with an emphasis on machine learning and/or artificial intelligence...."
"Research Analyst or Statitician","State Farm Mutual Automobile Insurance Company","Bloomington, IL 61701","NA",nan,51.0,"Academic background in quantitative disciplines and methodologies such as applied and computational statistics, text and data mining, artificial intelligence,..."
"Research Scientist -- Computer Vision & Machine Learning","Infox Consulting","Seattle, WA","NA",nan,nan,"Expert in research areas such as computer vision, artificial intelligence, machine learning, particularly including areas such as deep learning, Experience with..."
"Leading Technical Product Owner","Workbridge Associates","Plano, TX","$130,000 - $150,000 a year",32,40.8,"Understanding of knowledge based systems such as Machine Learning, Artificial Intelligence, and Event/Robotic automation...."
"Research Associate","University of Utah","Salt Lake City, UT","$60,000 - $90,000 a year",322,52.8,"Recent experience with machine learning and/or artificial intelligence technology. The goal of this Research Associate position is to conduct and to support..."
"Marine Resource Coordinator","Okaloosa County","Fort Walton Beach, FL","$18.02 - $26.60 an hour",7,54.6,"Oversees management of artificial reef program; Plans, coordinates programs, and seeks funding related to coastal recreation, product improvement, sustainable..."
"Research Scientist, Onboard Perception","Toyota Research Institute","Los Altos, CA","NA",nan,nan,"And (4) accelerate scientific discovery by applying techniques from artificial intelligence and machine learning...."
"NA","NVIDIA","Santa Clara, CA","NA",137,52.2,"Artificial intelligence, the dream of computer scientists for over half a century, is no longer science fiction...."
"RESEARCH TECHNICIAN, College of Arts & Sciences, Psychology","Boston University","Boston, MA","NA",244,51.6,"Candidates must have prior experience programming in MATLAB or Python, and an undergraduate degree in a field that includes modeling (Engineering,Computer..."
