"jobtitle","company","location","salary","companysize","companyrating","summary"
"Computer Scientist - Artificial Intelligence","USC","Marina del Rey, CA","NA",439,52.2,"The Information Sciences Institute (ISI) is home to over 100 researchers in artificial intelligence who carry out world-class research in a collaborative,..."
"Research Software Engineer - Artificial Intelligence","IBM","United States","NA",nan,51.0,"We are looking for hardware and software engineers, developers and scientists who are as passionate as we are about Artificial Intelligence ( AI ), advancing..."
"Sr. AI Data Scientist","Lenovo","Raleigh, NC 27616 (Northeast area)","NA",623,44.4,"Lenovo is gearing up to lead the intelligence transformation by making Artificial Intelligence (AI) applications easy to develop and deploy in data centers to..."
"AI / Machine Learning Engineer","HuntSource","Austin, TX","NA",nan,nan,"In Machine Learning, Artificial Intelligence, Computer Science, or related field _preferred_. Needs to be deeply passionate about strategic business..."
"Research Scientist, Machine Learning and Intelligence","Google","Mountain View, CA","NA",nan,52.8,"Experience in Natural Language Understanding, Computer Vision, Machine Learning, Algorithmic Foundations of Optimization, Data Mining or Machine Intelligence..."
"Machine Learning Engineer","Toyota Research Institute","Los Altos, CA","NA",nan,nan,"And (4) accelerate scientific discovery by applying techniques from artificial intelligence and machine learning...."
"Research Assistant","Element Inc.","New York, NY","NA",nan,nan,"Element was co-founded by Yann LeCun, a founding father of the deep learning field and current head of Artificial Intelligence at Facebook...."
"Artificial Intelligence / Machine Learning Advanced Technolo...","BOEING","Seattle, WA","NA",nan,51.6,"The Boeing Company is seeking a talented and highly motivated machine learning and artificial intelligence professional to work and lead the design, development..."
"Software Engineer - Machine Learning & Artificial Intelligen...","Lynker Technologies","Tuscaloosa, AL","NA",nan,nan,"NA"
"Software Firmware Engineer, Google Hardware Machine Learning","Google","Mountain View, CA","NA",nan,52.8,"We're looking for engineers who bring fresh ideas from all areas, including information retrieval, distributed computing, large-scale system design, networking..."
"Machine Learning Deployment Engineer, Professional Services,...","Google","Chicago, IL 60607 (Near West Side area)","NA",nan,52.8,"Machine learning, recommendation systems, natural language processing, computer vision, pattern recognition, or artificial intelligence...."
"Data Scientist - Advanced Analytics and Emerging Technologis","Anadarko Petroleum Corporation","The Woodlands, TX","NA",184,53.4,"Execution of a wide range of projects across the Artificial Intelligence and Machine Learning domains. As part of the Data Science & Advanced Analytics team,..."
"Sr Data Scientist - Advanced Analytics and Emerging Technolo...","Anadarko Petroleum Corporation","The Woodlands, TX","NA",184,53.4,"Execution of a wide range of projects across the Artificial Intelligence and Machine Learning domains. As part of the Data Science & Advanced Analytics team,..."
"Lead Artificial Intelligence Engineer","Mitre Corporation","McLean, VA","NA",142,52.2,"Lead Artificial Intelligence Engineer - (29962BR). The Cognitive Science & Artificial Intelligence Department (K83A) has a business need for a Lead Artificial..."
"Deep Learning Computational Graph Engineer","Intel","San Diego, CA 92129","NA",nan,52.2,"NA"
"Data Scientist","Microsoft","Redmond, WA 98052","NA",nan,52.2,"Currently we are expanding our team to support projects that focus on Artificial Intelligence and Cognitive analytics...."
"Machine Learning / Artificial Intelligence Scientist","Ford Motor Company","Dearborn, MI","NA",nan,52.8,"NA"
"NA","IBM","United States","NA",nan,51.0,"NA"
"Software Development Engineer - Machine Learning / Artificia...","Target Finders Inc","The Woodlands, TX","NA",nan,nan,"NA"
"Machine Learning Scientist","Align Technology Inc","Raleigh, NC","NA",36,51.0,"NA"
"Editorial Writer","The New York Times","New York, NY","NA",135,51.0,"NA"
"Data Scientist - Amazon AWS AI","Amazon Corporate LLC","Palo Alto, CA","NA",nan,43.2,"NA"
"Sr. Machine Learning / Artificial Intelligence Engineer","ClosedLoop.ai","Austin, TX 78701 (Downtown area)","NA",nan,nan,"NA"
"Applied Machine Learning Engineer - Business Platform","Uber","Seattle, WA 98101 (Downtown area)","NA",214,44.4,"NA"
"Machine Learning Platform Engineer","Apple","Pittsburgh, PA 15237","NA",nan,52.2,"NA"
"Research Engineer","Nauto","Palo Alto, CA","NA",nan,nan,"NA"
"Machine Learning Scientist","Amazon Corporate LLC","Seattle, WA","NA",nan,43.2,"NA"
"Machine Learning Engineer","Xilinx","San Jose, CA 95124 (Cambrian Park area)","NA",69,44.4,"Xilinx is seeking an engineer to join our R&D team developing future generation technologies for machine learning and artificial intelligence...."
"Machine Learning Engineer","Dropbox","San Francisco, CA","NA",15,44.4,"NA"
"Online Chat Support Representative","CarLabs","Los Angeles, CA","$35,000 - $37,000 a year",nan,nan,"Interest in the automotive industry or artificial intelligence is also a plus. We are looking for a representative to join our human support team...."
"Junior Data Scientist","Aquasight","Troy, MI 48084","NA",nan,nan,"Optimization and simulation using machine learning and artificial intelligence techniques. Aquasight is a Big-Data IoT business for the life cycle of water..."
"Data Scientist and Machine Learning Researcher","American Express","New York, NY","NA",nan,52.2,"NA"
"Senior Product Manager, Artificial Intelligence and Machine...","Keller Williams","Austin, TX 78746","NA",nan,53.4,"Senior Product Manager, Artificial Intelligence and Machine Learning. We are looking for a Senior Product Manager, Artificial Intelligence and Machine Learning..."
"Research Software Engineer, Google Brain","Google","New York, NY 10011 (Chelsea area)","NA",nan,52.8,"Participate in cutting-edge research in artificial intelligence and machine learning applications. MS or PhD degree in Computer Science, Artificial Intelligence..."
"NA","HBO","New York, NY","NA",86,52.8,"Be a thought leader in the adoption of machine learning and artificial intelligence approaches or tools in audience and customer engagement...."
"Machine Learning Engineer","HomeLight","San Francisco, CA","NA",nan,nan,"NA"
"Student Research Collaboration","Google","Pittsburgh, PA","NA",nan,52.8,"Experience (classroom or work related) in Natural Language Understanding, Neural Networks, Computer Vision, Machine Learning, Deep Learning, Algorithmic..."
"Software Engineering Intern: Back-End","Apple","Santa Clara Valley, CA","NA",nan,52.2,"Natural Language, Machine Learning, and/or Artificial Intelligence experience is a plus. Apple is currently seeking enthusiastic interns who can work full-time..."
"Data Scientist","ABBOTT LABORATORIES","Irving, TX 75038","NA",nan,52.2,"NA"
"Data Analyst (ML/AI) with J2EE/Spring","Loginsoft Consulting LLC","Township of Warren, NJ","NA",nan,nan,"Experience with Artificial Intelligence (AI) / Machine learning methodologies is mandatory. We are looking only for candidates willing to join us directly as W2..."
"Data Scientist","Hyperloop One","Los Angeles, CA","NA",5,51.0,"The Data Scientist / Analyst will be part of the Machine Intelligence and Analytics team. Develop metrics and evaluation criteria to characterize and quantify..."
"Software Engineer, Cloud Machine Learning","Google","Mountain View, CA","NA",nan,52.8,"Participate in cutting edge research in artificial intelligence and machine learning applications. 2 years of work or educational experience in Machine Learning..."
"Machine Learning Scientist","Cogito Corporation","Boston, MA 02109 (Central area)","NA",nan,nan,"Work at the cutting edge of Artificial Intelligence and Machine Learning. The Machine Learning Scientist will bolster the modeling expertise and will help..."
"Machine Learning Engineer","Apple","Santa Clara Valley, CA","NA",nan,52.2,"Create groundbreaking technology for large scale systems, spoken language, big data, and artificial intelligence...."
"Principle Engineer","Intellipro Group Inc.","Santa Clara, CA","NA",nan,nan,"Machine learning, recommendation systems, categorization, large-scale data mining or artificial intelligence, NLP...."
"Data Scientist","Wells Fargo","Charlotte, NC","NA",nan,43.8,"NA"
"Applied AI Engineer","Bonsai","Berkeley, CA","NA",7,42.6,"The ideal candidate is a talented, experienced, and passionate Artificial Intelligence Engineer with a broad knowledge of machine learning techniques to help..."
"Cloud Machine Learning Research Scientist","Google","Mountain View, CA","NA",nan,52.8,"Participate in cutting-edge research in artificial intelligence and machine learning applications. Experience in Natural Language Understanding, Computer Vision..."
"Deep Learning Research Engineer","Intellipro Group Inc.","San Jose, CA 95134 (North San Jose area)","NA",nan,nan,"Produce Intellectual property in the general area of artificial intelligence and/or autonomous driving; Job Tasks and Responsibilities:...."
"Jr Software Engineer","Leidos","Arlington, VA 22202 (Aurora Highlands area)","NA",284,43.8,"They may also assist in user interface or artificial intelligence development. Leidos is a global science and technology solutions leader working to solve the..."
"Jr. Unity 3D Programmer","AVNIK Defense Solutions, Inc.","Huntsville, AL","NA",nan,nan,"Familiarity with one or more programming specialties (virtual reality/augmented reality, artificial intelligence, 3D Visualization, 3D Rendering, 3D animation,..."
"Research Scientist, Google Brain (United States)","Google","New York, NY 10011 (Chelsea area)","NA",nan,52.8,"Experience in Natural Language Understanding, Computer Vision, Machine Learning, Algorithmic Foundations of Optimization, Data Mining or Machine Intelligence..."
"Manager, Business Analytics and Reporting","Allegion","Carmel, IN","NA",58,43.8,"Leading digital transformation, IOT, and Artificial Intelligence. Ability to drive end-user adoption of Business Intelligence solutions...."
"Research Engineer - Machine Learning","Samsung Research America","Mountain View, CA 94043","NA",nan,51.0,"NA"
"Deep Learning & Computer Vision Software Engineer","NVIDIA","Santa Clara, CA","NA",137,52.2,"Advanced degree (MS or PhD) with a focus in Deep Learning, Computer Vision, or Artificial Intelligence; Expertise in deep learning, deep neural networks,..."
"Software Engineer-Machine Learning","CivilMaps","San Francisco, CA","NA",nan,nan,"Through artificial intelligence and vehicle-based local processing, Civil Maps converts sensor data into meaningful map information built specifically to direct..."
"Research Associate","Center for a New American Security","Washington, DC 20005 (Logan Circle area)","NA",nan,nan,"Artificial intelligence and automation raise profound questions about the role of humans in conflict and war...."
"Artificial Intelligence Engineer","Business Integra","Wall Street, NY","NA",nan,nan,"Artificial Intelligence (Experience with NLP natural language processing)*. Wall Street, NY*...."
"Deep Learning and Action Recognition Research Associate","NIBR","Cambridge, MA","NA",nan,nan,"Machine Learning, Deep Learning, and Artificial Intelligence related projects. Exploiting cutting-edge technologies, such as targeted genome editing, in vivo..."
"Data Scientist - AWS Professional Services","Amazon Web Services, Inc.","Herndon, VA","NA",nan,43.2,"Want to help the largest global enterprises derive business value through the adoption of Artificial Intelligence (AI)?..."
"Data Scientist","DISH Network","Englewood, CO","NA",nan,40.8,"Satellite/DVB, IP, etc.)Well-developed ability to lead a small teamExperience with Machine Learning or Artificial Intelligence (AI) algorithmsDish Technologies..."
"Automated Vehicle Research Engineer","Lumenance LLC","Detroit, MI 48202 (New Center area)","NA",nan,nan,"We are looking for engineers with development experience in Robotics, artificial intelligence or machine learning...."
"Software Engineer, Infrastructure","Google","Kirkland, WA","NA",nan,52.8,"We're looking for engineers who bring fresh ideas from all areas, including information retrieval, distributed computing, large-scale system design, networking..."
"Artificial Intelligence (AI) Software Engineer","Sprint","Overland Park, KS 66210","NA",nan,43.8,"Sprint is looking for an Artificial Intelligence (AI) Architect. Bring your Artificial Intelligence/ Machine Learning expertise to Sprint and be a pioneer in..."
"Technology Solutions Professional","Microsoft","Tampa, FL 33609 (Swann Estates area)","NA",nan,52.2,"Our role is to assist these heroes and augment what they do with our expertise in cloud, business processes, enterprise productivity, and Artificial..."
"Robotics Research Scientist in Intelligent Manipulation","Schlumberger","Cambridge, MA","NA",nan,51.6,"Deep theoretical foundation in artificial intelligence applicable to robotic systems. Robotics Research Scientist in Intelligent Manipulation...."
"Technolgy Solutions Professional-Business Intelligence","Microsoft","Seattle, WA 98188","NA",nan,52.2,"Business Intelligence architect. Certification in business intelligence preferred. Our role is to assist these heroes and augment what they do with our..."
"Research Engineer","Salesforce","Palo Alto, CA","NA",246,52.8,"Participate in cutting-edge research in machine learning and artificial intelligence. MA/MS or PhD degree in Computer Science, Artificial Intelligence, Machine..."
"RESEARCH ENGINEER - Data Processing","Banzan International Group Corporation","Acton, MA 01720","NA",nan,nan,"Apply data mining, artificial intelligence, signal processing techniques to the R&D of pipe network monitoring, warning and early assessment systems...."
"Deep Learning Research Scientist","Intel","San Diego, CA 92129","NA",nan,52.2,"NA"
"Data Scientist Analyst Stf","Lockheed Martin","Littleton, CO 80127","NA",nan,51.6,"Previous experience with artificial intelligence or advanced algorithm development. Applying data science against open source media to support Intelligence..."
"Data Scientist","Bed Bath & Beyond","Union, NJ 07083","NA",nan,42.6,"Expert knowledge of Advance Machine Learning (Deep learning) and Artificial Intelligence (AI) techniques and applications...."
"Director, Data Science and Biostatistics","Boston Scientific Corporation","Valencia, CA 91355","NA",722,51.0,"Identifies opportunities for innovation by applying data science and analytic methodologies, including machine learning and artificial intelligence, to research..."
"Accenture Analytics-CPG Data Scientist","Accenture","New York, NY 10011 (Chelsea area)","NA",nan,51.0,"Accenture Analytics, part of Accenture Digital, helps clients to use analytics and artificial intelligence to drive actionable insights, at scale...."
"Instagram - Software Engineer, Machine Learning Menlo Park","Facebook","Menlo Park, CA","NA",189,52.2,"Machine learning, recommendation systems, pattern recognition, large-scale data mining or artificial intelligence...."
"Artificial Intelligence/Machine Learning Research Developer","NBCUniversal","Englewood Cliffs, NJ","NA",nan,51.6,"NA"
"Research Engineer","Raytheon","Dulles, VA","NA",nan,51.0,"Are you interested in machine learning, artificial intelligence, and other forms of artificial cognition? The successful candidate will have a knack for taking..."
"Senior Director, Professional Services","Aspect Software Inc","Remote","NA",4,54.0,"Our ability to think big has enabled us to continually evolve and lead the market, and to stay on the forefront with exciting technologies including cloud,..."
"Machine Learning Engineer, Proactive Intelligence","Apple","Santa Clara Valley, CA","NA",nan,52.2,"Create groundbreaking technology for large-scale systems, spoken language, big data, and artificial intelligence...."
"Machine Learning Engineer","Faraday Future, Inc.","San Jose, CA","NA",nan,nan,"NA"
"Machine Learning Engineer","Creospan Solutions","Chicago, IL","$75 - $90 an hour",nan,nan,"BS degree in Computer Science, Machine Learning or Artificial Intelligence major is preferred. Minimum of 2-3 years full time hands-on machine learning or..."
"Scientist, Data Sciences","Johnson & Johnson Family of Companies","Spring House, PA","NA",nan,52.8,"Statistics, Machine Learning & Artificial Intelligence, Physics, Molecular. Janssen Research & Development LLC, a...."
"Research Scientist, Machine Learning & Signal Processing","Facebook","Redmond, WA","NA",189,52.2,"Individuals in this role are expected to be recognized experts in identified research areas such as artificial intelligence, machine learning, computational..."
"Autopilot Internship (Spring 2018)","Tesla Motors","Palo Alto, CA","NA",545,43.2,"Individuals in this role are expected to be experts in identified research areas such as computer vision, artificial intelligence, machine learning, and applied..."
"Data Scientist","Ford Motor Company","Dearborn, MI","NA",nan,52.8,"2+ years of experience with Machine Learning and Artificial Intelligence techniques and tools to include one or more of the following:...."
"Senior Product Manager","Nauto","Palo Alto, CA","NA",nan,nan,"NA"
"Search Strategist (SEO) - Remote","Propecta","Lake Geneva, WI 53147","NA",nan,nan,"Propecta builds holistic, high-impact SEO strategies for the era of RankBrain and artificial intelligence; Provides full-service execution when needed;..."
"Machine Learning Systems Engineer","Intel","Hillsboro, OR 97124","NA",nan,52.2,"Come join Intel's Artificial Intelligence Group, t his position focuses on data analytics applications using deep learning and machine learning approaches...."
"Backend Software Engineer, Machine Learning Platform","Apple","Pittsburgh, PA 15237","NA",nan,52.2,"NA"
"Data Scientist","INgrooves Music Group","Los Angeles, CA","NA",nan,nan,"NA"
"Deep Learning Compiler Engineer","NVIDIA","Santa Clara, CA","NA",137,52.2,"Academic and commercial groups around the world are using GPUs to power a revolution in deep learning, enabling breakthroughs in problems from image..."
"Artificial Intelligence Engineer - Dialog","Interactions LLC","New York, NY 10002 (Lower East Side area)","NA",38,40.2,"NA"
"Content Editor/Copywriter (Contract to hire)","i.am+","Los Angeles, CA","NA",nan,nan,"Our vision is to create a community of creatives and engineers that believe through music and technology as the first step, we can usher in a powerful new era..."
"Software Engineer, Sensors, Google Hardware","Google","Mountain View, CA","NA",nan,52.8,"We're looking for engineers who bring fresh ideas from all areas, including information retrieval, distributed computing, large-scale system design, networking..."
"Junior Social Editor (IN-HOUSE OR REMOTE)","Futurism","Brooklyn, NY","NA",nan,nan,"Coverage topics include artificial intelligence, robotics, space exploration, virtual reality, and much more...."
"Software Engineer, Machine Learning, USA","Cortical.io","New York, NY","NA",nan,nan,"A permanent position with Cortical.io, a leading startup that lives and breathes Artificial Intelligence (AI) and Natural Language Processing (NLP) and which..."
"Software Engineer","Google","Kirkland, WA","NA",nan,52.8,"We're looking for engineers who bring fresh ideas from all areas, including information retrieval, distributed computing, large-scale system design, networking..."
"Data Analyst Intern","Ubisoft","San Francisco, CA 94107 (South Of Market area)","NA",124,51.0,"NA"
"Technical Solutions Professional","Microsoft","Pittsburgh, PA 15212","NA",nan,52.2,"Being part of this team will allow you to maintain and develop your deep technical expertise & thought leadership across Microsoft & Open Source Advanced..."
"Research Staff Member","IBM","Yorktown Heights, NY","NA",nan,51.0,"Applications of artificial intelligence in distributed systems, and accelerated cognitive services. Advanced knowledge of artificial intelligence computing..."
"Writer","Udacity, Inc.","Mountain View, CA 94040","NA",6,55.8,"We're an online learning platform offering groundbreaking education in fields such as artificial intelligence, machine learning, robotics, virtual reality, and..."
"Deep Learning Engineer","Nauto","Palo Alto, CA","NA",nan,nan,"NA"
"Customer Engagement Manager","General Electric","Boston, MA 02212 (Central area)","NA",nan,51.6,"We are looking for a Customer Engagement Manager to work with key Artificial Intelligence(AI), Deep Learning(DL) Clinical Partnership accounts to drive the..."
"Innovation Architect, Learning & Development","Facebook","Menlo Park, CA","NA",189,52.2,"Experience with virtual reality, augmented reality, artificial intelligence and machine learning. Facebook's mission is to give people the power to build..."
"Visiting Scientist, Sabbatical (AI)","Facebook","Menlo Park, CA","NA",189,52.2,"Facebook is seeking Visiting Scientists to join our Facebook Artificial Intelligence Research team. Facebook's mission is to give people the power to build..."
"NLP Developer","Ai Software","St. Louis, MO","NA",nan,nan,"Ai Software is building an artificial intelligence platform to transform the modern workforce. Ai Software engineers enjoy the opportunity and benefits of..."
"Watson Software Engineer -- Cloud Services & Machine Learnin...","IBM","Denver, CO 80237 (Southeastern Denver area)","NA",nan,51.0,"It is an exciting time to join IBM Watson & Cloud Platform in the Artificial Intelligence space. IBM is on the forefront of cloud and the leader of Hybrid Cloud..."
"Multimedia Software Safety Architect","NVIDIA","Santa Clara, CA","NA",137,52.2,"We are the leading artificial intelligence computing company and are paving the way with innovations in self-driving cars, machine learning, supercomputing,..."
"Senior Product Manager, New Products and Innovation","Adobe","San Jose, CA","NA",328,52.2,"NA"
"Project Coordinator (Contract)","Udacity, Inc.","San Francisco, CA","NA",6,55.8,"These projects are integral parts of our Nanodegree programs, covering areas such as Artificial Intelligence, Autonomous Systems, and more ...."
"Computer Vision Research Engineer","Intellipro Group Inc.","San Jose, CA 95134 (North San Jose area)","NA",nan,nan,"Produce Intellectual property in the general area of artificial intelligence and/or autonomous driving; Job Tasks and Responsibilities:...."
"Administrative Assistant","ZT Systems","Secaucus, NJ 07094","NA",23,32.4,"NA"
"Senior Machine Learning and Compiler Engineer","NVIDIA","Austin, TX","NA",137,52.2,"NA"
"Senior Program Manager","Microsoft","Bellevue, WA","NA",nan,52.2,"NA"
"Mapping and Localization Research Engineer","Intellipro Group Inc.","San Jose, CA 95134 (North San Jose area)","NA",nan,nan,"NA"
"Data Modeler","Scienaptic Systems Inc","New York, NY","NA",nan,nan,"NA"
"Marketing Assistant/Receptionist","Hanhai Studio","Burbank, CA","NA",nan,nan,"NA"
"Research Scientist","Adobe","San Jose, CA","NA",328,52.2,"NA"
"Artificial Intelligence - Team Lead and Developer","Aira Tech Corp","San Diego, CA","NA",nan,nan,"NA"
"Senior Frontend Developer","Intelletec","New York, NY 10001 (Chelsea area)","$120,000 - $140,000 a year",nan,nan,"NA"
"Deep Learning Scientist","Oben","Pasadena, CA","NA",nan,nan,"NA"
"Software Engineer, Firmware, Consumer Hardware","Google","Mountain View, CA","NA",nan,52.8,"NA"
"Sr. VP of Research","Huawei","Bridgewater, NJ","NA",nan,43.8,"NA"
"Junior Visual Designer","MARKMONITOR","Boise, ID 83713 (West Valley area)","NA",6,43.2,"NA"
"Data Scientist","Uptake","Chicago, IL","NA",2,51.0,"NA"
"3D Character Animation Programmer, Machine Learning","Carnegie Mellon University","Pittsburgh, PA","NA",135,52.8,"NA"
"Siri Text-to-Speech Software Engineer","Apple","Santa Clara Valley, CA","NA",nan,52.2,"NA"
"Data Scientist 3 with CACI International Inc","CACI International Inc","North Charleston, SC","NA",nan,44.4,"NA"
"Data Science Platform Developer","Iodine Software","Austin, TX 78759 (Arboretum area)","NA",nan,nan,"NA"
"Post-Doctoral Researcher, Artificial Intelligence","IBM","United States","NA",nan,51.0,"NA"
"Linguistic Engineer / Applied Linguist","Aspect Software Inc","Chelmsford, MA 01824","NA",4,54.0,"Our ability to think big has enabled us to continually evolve and lead the market, and to stay on the forefront with exciting technologies including cloud,..."
"Front End Software Engineer","Google","New York, NY 10011 (Chelsea area)","NA",nan,52.8,"We're looking for engineers who bring fresh ideas from all areas, including information retrieval, distributed computing, large-scale system design, networking..."
"Research Summer Intern","IBM","United States","NA",nan,51.0,"Cognitive computing and augmented intelligence; We have many internships available and are seeking highly motivated students with a background in computer..."
"Data Scientist","Burgeon IT Services","Houston, TX","NA",nan,nan,"Minimum 8 years of relevant experience in applying data mining, artificial intelligence, signal processing, machine learning, optimization etc. in business..."
"Research Intern (AI)","Facebook","Menlo Park, CA","NA",189,52.2,"We are committed to advancing the field of artificial intelligence by making fundamental advances in technologies to help interact with and understand our world..."
"Senior Product Manager","Cylance, Inc.","Portland, OR 97204 (Downtown area)","NA",6,52.2,"By successfully applying artificial intelligence and machine learning to crack the DNA of malware, Cylance has redefined the endpoint protection market,..."
"Research Scientist--Computer Vision & Machine Learning","Hikvision USA Inc.","Santa Clara, CA","NA",nan,nan,"HRA has the Artificial Intelligence, Big Data, and Technology Partnership teams at this location. Its Research Institute accumulates over a decade R&D..."
